<?xml version="1.0" encoding="UTF-8"?>
<Zahtev_za_priznanje_patenta xmlns="http://ftn.uns.ac.rs/p1"
 xmlns:xsi="http://www.w3.org/2001/XMLSchema-instance"
 xsi:schemaLocation="http://ftn.uns.ac.rs/p1 file:/C:/Users/LAZAR/Desktop/XML_i_web_servisi/Projekat/Projekat/XML-PROJEKAT-TIM15/back/p1/src/main/resources/xsd/p1schema.xsd">
    <Popunjava_zavod>
        <Broj_prijave>Broj_prijave0</Broj_prijave>
        <Datum_prijema>2006-05-04</Datum_prijema>
        <Priznati_datum_podnosenja>2006-05-04</Priznati_datum_podnosenja>
    </Popunjava_zavod>
    <Naziv_pronalaska>
        <Naziv_pronalaska_na_srpskom>Naziv_pronalaska_na_srpskom0</Naziv_pronalaska_na_srpskom>
        <Naziv_pronalaska_na_engleskom>Naziv_pronalaska_na_engleskom0</Naziv_pronalaska_na_engleskom>
    </Naziv_pronalaska>
    <Podnosilac_prijave>
        <Podaci_o_licu xmlns:p1="http://ftn.uns.ac.rs/p1" xsi:type="p1:TFizicko_lice">
            <Adresa>
                <Ulica>Ulica0</Ulica>
                <Broj>50</Broj>
                <Mesto>Mesto0</Mesto>
                <Postanski_broj>25500</Postanski_broj>
            </Adresa>
            <Kontakt>
                <Telefon>Telefon0</Telefon>
                <Faks>Faks0</Faks>
                <Email>Email0</Email>
            </Kontakt>
            <Ime>Ime0</Ime>
            <Prezime>Prezime0</Prezime>
            <Drzavljanstvo>Drzavljanstvo0</Drzavljanstvo>
        </Podaci_o_licu>
    </Podnosilac_prijave>
    <Pronalazac_patenta>
        <Podaci_o_licu xmlns:p1="http://ftn.uns.ac.rs/p1" xsi:type="p1:TFizicko_lice">
            <Adresa>
                <Ulica>Ulica1</Ulica>
                <Broj>50</Broj>
                <Mesto>Mesto1</Mesto>
                <Postanski_broj>25500</Postanski_broj>
            </Adresa>
            <Kontakt>
                <Telefon>Telefon1</Telefon>
                <Faks>Faks1</Faks>
                <Email>Email1</Email>
            </Kontakt>
            <Ime>Ime1</Ime>
            <Prezime>Prezime1</Prezime>
            <Drzavljanstvo>Drzavljanstvo1</Drzavljanstvo>
        </Podaci_o_licu>
    </Pronalazac_patenta>
    <Predstavnik_patenta>
        <Podaci_o_licu xmlns:p1="http://ftn.uns.ac.rs/p1" xsi:type="p1:TFizicko_lice">
            <Adresa>
                <Ulica>Ulica2</Ulica>
                <Broj>50</Broj>
                <Mesto>Mesto2</Mesto>
                <Postanski_broj>25500</Postanski_broj>
            </Adresa>
            <Kontakt>
                <Telefon>Telefon2</Telefon>
                <Faks>Faks2</Faks>
                <Email>Email2</Email>
            </Kontakt>
            <Ime>Ime2</Ime>
            <Prezime>Prezime2</Prezime>
            <Drzavljanstvo>Drzavljanstvo2</Drzavljanstvo>
        </Podaci_o_licu>
        <Punomocnik>zastupanje</Punomocnik>
        <Zajednicki_predstavnik>false</Zajednicki_predstavnik>
    </Predstavnik_patenta>
    <Dostavljanje>
        <Adresa>
            <Ulica>Ulica3</Ulica>
            <Broj>50</Broj>
            <Mesto>Mesto3</Mesto>
            <Postanski_broj>25500</Postanski_broj>
        </Adresa>
        <Dostavljanje_elektronskim_putem>false</Dostavljanje_elektronskim_putem>
    </Dostavljanje>
    <Zahtevi_za_priznanje_prava_prvenstva_iz_ranijih_prijava>
        <Zahtev_za_priznanje_prava_prvenstva_iz_ranijih_prijava>
            <Datum_podnosenja_ranije_prijave>2006-05-04</Datum_podnosenja_ranije_prijave>
            <Broj_ranije_prijave>Broj_ranije_prijave0</Broj_ranije_prijave>
            <Dvoslovna_oznaka_drzave_regionalne_ili_medjunarodne_organizacije>Dvoslovna_oznaka_drzave_regionalne_ili_medjunarodne_organizacije0</Dvoslovna_oznaka_drzave_regionalne_ili_medjunarodne_organizacije>
        </Zahtev_za_priznanje_prava_prvenstva_iz_ranijih_prijava>
        <Zahtev_za_priznanje_prava_prvenstva_iz_ranijih_prijava>
            <Datum_podnosenja_ranije_prijave>2006-05-04</Datum_podnosenja_ranije_prijave>
            <Broj_ranije_prijave>Broj_ranije_prijave1</Broj_ranije_prijave>
            <Dvoslovna_oznaka_drzave_regionalne_ili_medjunarodne_organizacije>Dvoslovna_oznaka_drzave_regionalne_ili_medjunarodne_organizacije1</Dvoslovna_oznaka_drzave_regionalne_ili_medjunarodne_organizacije>
        </Zahtev_za_priznanje_prava_prvenstva_iz_ranijih_prijava>
    </Zahtevi_za_priznanje_prava_prvenstva_iz_ranijih_prijava>
</Zahtev_za_priznanje_patenta>
